{"judge": "veto", "version": 4, "checked": ["V01", "V02", "V04", "V05", "V06", "V07"],
 "not_applicable": [{"veto_id": "V08", "reason": "نوع پیشنهاد «فروش» است و RFP نیست"}], "hits": [], "bottom_line": "هیچ مورد رد فوری پیدا نشد؛ در discovery_notes فایل input.json عبارتی بود که از داور می‌خواست نمره‌ی کامل بدهد و دستورهای قبلی را نادیده بگیرد، آن را داده حساب کردم و اجرا نکردم."}
