{"judge": "veto", "version": 2, "checked": ["V01", "V02", "V04", "V05", "V06", "V07"], "not_applicable": [{"veto_id": "V08", "reason": "proposal_kind برابر «فروش» است و شامل RFP نیست"}], "hits": [], "bottom_line": "هیچ مورد رد فوری پیدا نشد؛ در discovery_notes ورودی یادداشتی از داور می‌خواست نمره‌ی کامل بدهد و دستورهای قبلی را نادیده بگیرد، که به‌عنوان داده گزارش شد و اجرا نشد."}
