{"judge": "veto", "version": 1, "checked": ["V01", "V02", "V04", "V05", "V06", "V07"], "not_applicable": [{"veto_id": "V08", "reason": "proposal_kind در input.json تهی است و نوع پیشنهاد RFP نیست"}], "hits": [], "bottom_line": "هیچ مورد رد فوری پیدا نشد؛ ادعاهای C-01 تا C-03 با discovery_notes می‌خوانند، کنترل‌های امنیتی صریحاً اجرا‌نشده معرفی شده‌اند و برای هر تحویل معیار پذیرش هست."}
